{
  "driver": "openai",
  "channels": {
    "stable": "v1.7.3"
  },
  "versions": {
    "v1.0.0": {
      "artifacts": [
        {
          "os": "linux",
          "arch": "amd64",
          "url": "https://github.com/Charles546/hd-driver-openai/releases/download/v1.0.0/hd-driver-openai-linux-amd64",
          "sha256": "a557fee9a241ccf0290163368e6ec882f70af040e2e0ed4bc7d2574c61cc057d",
          "fileName": "hd-driver-openai-linux-amd64"
        }
      ]
    },
    "v1.0.1": {
      "artifacts": [
        {
          "os": "linux",
          "arch": "amd64",
          "url": "https://github.com/Charles546/hd-driver-openai/releases/download/v1.0.1/hd-driver-openai-linux-amd64",
          "sha256": "2c520f57d66360c36400c61ac05b8cc45eb10410efc326ba020fc702c4da244d",
          "fileName": "hd-driver-openai-linux-amd64"
        }
      ]
    },
    "v1.1.0": {
      "artifacts": [
        {
          "os": "linux",
          "arch": "amd64",
          "url": "https://github.com/Charles546/hd-driver-openai/releases/download/v1.1.0/hd-driver-openai-linux-amd64",
          "sha256": "6cf524fa24fe32481ceafdc2b4fc79a5440391beb5906bece10968e13c85d080",
          "fileName": "hd-driver-openai-linux-amd64"
        }
      ]
    },
    "v1.1.1": {
      "artifacts": [
        {
          "os": "linux",
          "arch": "amd64",
          "url": "https://github.com/Charles546/hd-driver-openai/releases/download/v1.1.1/hd-driver-openai-linux-amd64",
          "sha256": "8e496926a377844353ef97c8743fa90c3bb7c6556ef1194612f4d26bc78eced1",
          "fileName": "hd-driver-openai-linux-amd64"
        }
      ]
    },
    "v1.1.2": {
      "artifacts": [
        {
          "os": "linux",
          "arch": "amd64",
          "url": "https://github.com/Charles546/hd-driver-openai/releases/download/v1.1.2/hd-driver-openai-linux-amd64",
          "sha256": "3725a67cd53fbee7b848d04767cfffb511e2781be52cce1c4e839db01f1676c5",
          "fileName": "hd-driver-openai-linux-amd64"
        }
      ]
    },
    "v1.1.3": {
      "artifacts": [
        {
          "os": "linux",
          "arch": "amd64",
          "url": "https://github.com/Charles546/hd-driver-openai/releases/download/v1.1.3/hd-driver-openai-linux-amd64",
          "sha256": "fb5ec5b85776020125e7dfd0cd90894f17d95629e02ff8ac459b274ed8925913",
          "fileName": "hd-driver-openai-linux-amd64"
        }
      ]
    },
    "v1.2.0": {
      "artifacts": [
        {
          "os": "linux",
          "arch": "amd64",
          "url": "https://github.com/Charles546/hd-driver-openai/releases/download/v1.2.0/hd-driver-openai-linux-amd64",
          "sha256": "a7004e4b9fab8b08302e6b7399905778bd7abfb4c1dbd73adf19dd029cdaca27",
          "fileName": "hd-driver-openai-linux-amd64"
        }
      ]
    },
    "v1.3.0": {
      "artifacts": [
        {
          "os": "linux",
          "arch": "amd64",
          "url": "https://github.com/Charles546/hd-driver-openai/releases/download/v1.3.0/hd-driver-openai-linux-amd64",
          "sha256": "d0e6789e5b71ee38bc00573da267a82f2a07d9baf8ec5d07e0247ba053c9cdcd",
          "fileName": "hd-driver-openai-linux-amd64"
        }
      ]
    },
    "v1.3.1": {
      "artifacts": [
        {
          "os": "linux",
          "arch": "amd64",
          "url": "https://github.com/Charles546/hd-driver-openai/releases/download/v1.3.1/hd-driver-openai-linux-amd64",
          "sha256": "81550a5bb590337b74dd8a2d5ae0bdd83b7d20f99f05d0f131cd56374dbeea77",
          "fileName": "hd-driver-openai-linux-amd64"
        }
      ]
    },
    "v1.3.2": {
      "artifacts": [
        {
          "os": "linux",
          "arch": "amd64",
          "url": "https://github.com/Charles546/hd-driver-openai/releases/download/v1.3.2/hd-driver-openai-linux-amd64",
          "sha256": "6f7987b8b02639459331bff0d503c9bb8d510a8810b656201de9a3d2060571fa",
          "fileName": "hd-driver-openai-linux-amd64"
        }
      ]
    },
    "v1.4.0": {
      "artifacts": [
        {
          "os": "linux",
          "arch": "amd64",
          "url": "https://github.com/Charles546/hd-driver-openai/releases/download/v1.4.0/hd-driver-openai-linux-amd64",
          "sha256": "56f11313694c217e68f872176fe334d21b7ab7aa4f67a8f5f5a34b127b4e47fd",
          "fileName": "hd-driver-openai-linux-amd64"
        }
      ]
    },
    "v1.4.1": {
      "artifacts": [
        {
          "os": "linux",
          "arch": "amd64",
          "url": "https://github.com/Charles546/hd-driver-openai/releases/download/v1.4.1/hd-driver-openai-linux-amd64",
          "sha256": "5be3a72bb146eeae3e711df85d51c0e41d168662d634c4c66919ecedfa5d0f74",
          "fileName": "hd-driver-openai-linux-amd64"
        }
      ]
    },
    "v1.5.0": {
      "artifacts": [
        {
          "os": "linux",
          "arch": "amd64",
          "url": "https://github.com/Charles546/hd-driver-openai/releases/download/v1.5.0/hd-driver-openai-linux-amd64",
          "sha256": "a03b0ee88bcad5b8bfc5c4ed1fddee7c6e33267d28cb20edf0f63bc07347f567",
          "fileName": "hd-driver-openai-linux-amd64"
        }
      ]
    },
    "v1.6.0": {
      "artifacts": [
        {
          "os": "linux",
          "arch": "amd64",
          "url": "https://github.com/Charles546/hd-driver-openai/releases/download/v1.6.0/hd-driver-openai-linux-amd64",
          "sha256": "5eb60cfc9f52aa28c559ca00e1404072711e1b9a08db629edd57a844065a7bf5",
          "fileName": "hd-driver-openai-linux-amd64"
        }
      ]
    },
    "v1.6.1": {
      "artifacts": [
        {
          "os": "linux",
          "arch": "amd64",
          "url": "https://github.com/Charles546/hd-driver-openai/releases/download/v1.6.1/hd-driver-openai-linux-amd64",
          "sha256": "1dfbc51f20bb9ad41dc1da0ec6b951129dbbc925e66f111bed2c9a9996045a9e",
          "fileName": "hd-driver-openai-linux-amd64"
        }
      ]
    },
    "v1.6.2": {
      "artifacts": [
        {
          "os": "linux",
          "arch": "amd64",
          "url": "https://github.com/Charles546/hd-driver-openai/releases/download/v1.6.2/hd-driver-openai-linux-amd64",
          "sha256": "5bd1a62820428f921294dbff14bf26eb3989b3ab27aecc2b2d40da09f778fa8e",
          "fileName": "hd-driver-openai-linux-amd64"
        }
      ]
    },
    "v1.6.3": {
      "artifacts": [
        {
          "os": "linux",
          "arch": "amd64",
          "url": "https://github.com/Charles546/hd-driver-openai/releases/download/v1.6.3/hd-driver-openai-linux-amd64",
          "sha256": "6e5de7c710be6bc291b3f15571e850b76d48baef74d084e53d068f9420d1a8d7",
          "fileName": "hd-driver-openai-linux-amd64"
        }
      ]
    },
    "v1.7.0": {
      "artifacts": [
        {
          "os": "linux",
          "arch": "amd64",
          "url": "https://github.com/Charles546/hd-driver-openai/releases/download/v1.7.0/hd-driver-openai-linux-amd64",
          "sha256": "3831caecd7cb16113eaa6c9c0a42b963aa823ae7884ad9efd29394563dbd440a",
          "fileName": "hd-driver-openai-linux-amd64"
        }
      ]
    },
    "v1.7.1": {
      "artifacts": [
        {
          "os": "linux",
          "arch": "amd64",
          "url": "https://github.com/Charles546/hd-driver-openai/releases/download/v1.7.1/hd-driver-openai-linux-amd64",
          "sha256": "3747f9419384bdadeb52dd8685d257f8d17f00b6987832a07e7c89b7511ad32b",
          "fileName": "hd-driver-openai-linux-amd64"
        }
      ]
    },
    "v1.7.2": {
      "artifacts": [
        {
          "os": "linux",
          "arch": "amd64",
          "url": "https://github.com/Charles546/hd-driver-openai/releases/download/v1.7.2/hd-driver-openai-linux-amd64",
          "sha256": "ddc344fe6b79bfc2da2f146c233d65d1b4b1a0503964215ba8cee1d2bf9b0223",
          "fileName": "hd-driver-openai-linux-amd64"
        }
      ]
    },
    "v1.7.3": {
      "artifacts": [
        {
          "os": "linux",
          "arch": "amd64",
          "url": "https://github.com/Charles546/hd-driver-openai/releases/download/v1.7.3/hd-driver-openai-linux-amd64",
          "sha256": "bdc9c5b742898232333bf712fe4e91f45ea01dc26fd693ba4ae4cc1144a85022",
          "fileName": "hd-driver-openai-linux-amd64"
        }
      ]
    }
  },
  "latest": "v1.7.3"
}
