{
  "driver": "auth-github",
  "latest": "v0.3.2",
  "channels": {
    "stable": "v0.3.2"
  },
  "versions": {
    "v0.1.0": {
      "artifacts": [
        {
          "os": "linux",
          "arch": "amd64",
          "url": "https://github.com/Charles546/hd-driver-auth-github/releases/download/v0.1.0/hd-driver-auth-github",
          "sha256": "ab43290deac6302ce36f27303d7a53a3a8b95acfb7345178e28b75f73962a311",
          "fileName": "hd-driver-auth-github",
          "mirrors": [
            "https://charles546.github.io/honeydipper-registry/artifacts/hd-driver-auth-github/v0.1.0/linux-amd64/hd-driver-auth-github"
          ]
        }
      ]
    },
    "v0.2.0": {
      "artifacts": [
        {
          "os": "linux",
          "arch": "amd64",
          "url": "https://github.com/Charles546/hd-driver-auth-github/releases/download/v0.2.0/hd-driver-auth-github-linux-amd64",
          "sha256": "bea91e24d505bcbadb358629df79f00e7ece6b1eac54612f8016101a08c61e75",
          "fileName": "hd-driver-auth-github",
          "mirrors": [
            "https://charles546.github.io/honeydipper-registry/artifacts/hd-driver-auth-github/v0.2.0/linux-amd64/hd-driver-auth-github"
          ]
        }
      ]
    },
    "v0.3.0": {
      "artifacts": [
        {
          "os": "linux",
          "arch": "amd64",
          "url": "https://github.com/Charles546/hd-driver-auth-github/releases/download/v0.3.0/hd-driver-auth-github-linux-amd64",
          "sha256": "964c972bb1bc99695e571561aa368b30586ce5421a4f2f47f14b023c966602ef",
          "fileName": "hd-driver-auth-github",
          "mirrors": [
            "https://charles546.github.io/honeydipper-registry/artifacts/hd-driver-auth-github/v0.3.0/linux-amd64/hd-driver-auth-github"
          ]
        }
      ]
    },
    "v0.3.2": {
      "artifacts": [
        {
          "os": "linux",
          "arch": "amd64",
          "url": "https://github.com/Charles546/hd-driver-auth-github/releases/download/v0.3.2/hd-driver-auth-github-linux-amd64",
          "sha256": "df53858c62a187e877eb2360a54fd210425e928dd0716e70c684e6a2a6b13094",
          "fileName": "hd-driver-auth-github-linux-amd64"
        }
      ]
    }
  }
}
