{
  "driver": "docker",
  "latest": "v0.1.0",
  "channels": {
    "stable": "v0.1.0"
  },
  "versions": {
    "v0.1.0": {
      "artifacts": [
        {
          "os": "linux",
          "arch": "amd64",
          "url": "https://github.com/Charles546/hd-driver-docker/releases/download/v0.1.0/hd-driver-docker-linux-amd64",
          "sha256": "946d5b74b8cc726bd8d01026ceaab361f853547e2d599cd87a3f6f00d3ad691b",
          "fileName": "hd-driver-docker-linux-amd64",
          "mirrors": [
            "https://charles546.github.io/honeydipper-registry/artifacts/hd-driver-docker/v0.1.0/linux-amd64/hd-driver-docker"
          ]
        }
      ]
    }
  }
}
