{
  "driver": "podman",
  "latest": "v0.5.5",
  "channels": {
    "stable": "v0.5.5"
  },
  "versions": {
    "v0.1.0": {
      "artifacts": [
        {
          "os": "linux",
          "arch": "amd64",
          "url": "https://github.com/Charles546/hd-driver-podman/releases/download/v0.1.0/hd-driver-podman",
          "sha256": "b6b2da2d6bad334b1c36ac70bc4af3654da7ac6c0a16cc16966d83029dd1f68a",
          "fileName": "hd-driver-podman",
          "mirrors": [
            "https://charles546.github.io/honeydipper-registry/artifacts/hd-driver-podman/v0.1.0/linux-amd64/hd-driver-podman"
          ]
        }
      ]
    },
    "v0.2.0": {
      "artifacts": [
        {
          "os": "linux",
          "arch": "amd64",
          "url": "https://github.com/Charles546/hd-driver-podman/releases/download/v0.2.0/hd-driver-podman-linux-amd64",
          "sha256": "24634613187a80872163e89d19e7c5736bb803f8cf5d2d080347a1a01158b3ac",
          "fileName": "hd-driver-podman",
          "mirrors": [
            "https://charles546.github.io/honeydipper-registry/artifacts/hd-driver-podman/v0.2.0/linux-amd64/hd-driver-podman"
          ]
        }
      ]
    },
    "v0.3.0": {
      "artifacts": [
        {
          "os": "linux",
          "arch": "amd64",
          "url": "https://github.com/Charles546/hd-driver-podman/releases/download/v0.3.0/hd-driver-podman-linux-amd64",
          "sha256": "4dfc025bd218a6bb25961751be5ada42e80625f38ffd097391d1af70c73655a1",
          "fileName": "hd-driver-podman",
          "mirrors": [
            "https://charles546.github.io/honeydipper-registry/artifacts/hd-driver-podman/v0.3.0/linux-amd64/hd-driver-podman"
          ]
        }
      ]
    },
    "v0.5.3": {
      "artifacts": [
        {
          "os": "linux",
          "arch": "amd64",
          "url": "https://github.com/Charles546/hd-driver-podman/releases/download/v0.5.3/hd-driver-podman-linux-amd64",
          "sha256": "c7d9c71b022465c9ce978f76e74a0bd4314ea40e3f9d9273a9dad2e347bdef00",
          "fileName": "hd-driver-podman-linux-amd64"
        }
      ]
    },
    "v0.5.4": {
      "artifacts": [
        {
          "os": "linux",
          "arch": "amd64",
          "url": "https://github.com/Charles546/hd-driver-podman/releases/download/v0.5.4/hd-driver-podman-linux-amd64",
          "sha256": "c7d9c71b022465c9ce978f76e74a0bd4314ea40e3f9d9273a9dad2e347bdef00",
          "fileName": "hd-driver-podman-linux-amd64"
        }
      ]
    },
    "v0.5.5": {
      "artifacts": [
        {
          "os": "linux",
          "arch": "amd64",
          "url": "https://github.com/Charles546/hd-driver-podman/releases/download/v0.5.5/hd-driver-podman-linux-amd64",
          "sha256": "17f9b7ab067ca0491dbfd392745efb9fea729c79848bab1a7ce6912bfcd8aabf",
          "fileName": "hd-driver-podman-linux-amd64"
        }
      ]
    }
  }
}
